Name,Bio,Identifier,B.A.,B.S.,J.D.,Ph.D.,M.B.A,M.A.,M.S.,M.P.H.,M.D.,D.M.D.,non-JD,none
"KILDEE, Dan","[' (nephew of Dale Edward Kildee), \r', 'a Representative from Michigan; born in Flint, Genesee County, \r', 'Mich., August 11, 1958; graduated from Flint Northern High School, Flint, Mich., 1976; attended University of Michigan, Flint, Mich.; B.S., \r', 'Central Michigan University, Mount Pleasant, Mich.; founder, Genesee County \r', 'Land Bank; co-founder and chief executive, Center for Community Progress; \r', 'member of the Flint, Mich., board of education, 1977-1985; member of the \r', 'Genesee County, Mich., board of commissioners, 1985-1997; Genesee County, \r', 'Mich., treasurer, 1997-2009; elected as a Democrat to the One Hundred \r', 'Thirteenth and to the two succeeding Congresses (January 3, \r', '2013-present).\r']",K000380,0,1,0,0,0,0,0,0,0,0,0,1
"KILMER, Derek","['a Representative from Washington; born in Port Angeles, Clallam \r', 'County, Wash., January 1, 1974; A.B., Princeton University, Princeton, N.J., \r', '1996; D.Phil., University of Oxford, Oxford, England, 2003; businessman; member \r', 'of the Washington state house of representatives, 2005-2007; member of the \r', 'Washington state senate, 2007-2012; elected as a Democrat to the One Hundred \r', 'Thirteenth and to the two succeeding Congresses (January 3, \r', '2013-present).\r']",K000381,1,0,0,0,0,0,0,0,0,0,0,1
"KIND, Ron","['a Representative from Wisconsin; born in La Crosse, La Crosse \r', 'County, Wis., March 16, 1963; B.A., Harvard University, Cambridge, Mass., 1985; \r', 'M.A., London School of Economics, London, England, 1986; J.D., University of \r', 'Minnesota School of Law, Minneapolis, Minn., 1990; lawyer, private practice; \r', 'state prosecutor, La Crosse County, Wis., district attorney&#x2019;s office, \r', '1992-1996; elected as a Democrat to the One Hundred Fifth and to the ten \r', 'succeeding Congresses (January 3, 1997-present).\r']",K000188,1,0,1,0,0,1,0,0,0,0,1,0
"KING, Peter T.","['a Representative from New York; born in New York, New York County, \r', 'N.Y., April 5, 1944; B.A., St. Francis College, Brooklyn Heights, N.Y., 1965; \r', 'J.D., Notre Dame University, Notre Dame, Ind., 1968; New York Army National \r', 'Guard, 1968-1973; lawyer, private practice; Nassau County, N.Y. deputy \r', 'attorney, 1972-1974; member of the Hempstead, N.Y., town council, 1977-1981; \r', 'Nassau County, N.Y. comptroller, 1981-1993; elected as a Republican to the One \r', 'Hundred Third and to the twelve succeeding Congresses (January 3, \r', '1993-present); chair, Committee on Homeland Security (One Hundred Ninth and One \r', 'Hundred Twelfth Congresses).\r']",K000210,1,0,1,0,0,0,0,0,0,0,0,0
"KING, Steve","['a Representative from Iowa; born in Storm Lake, Buena Vista County, \r', 'Iowa, May 28, 1949; graduated from Denison Community High School, Denison, \r', 'Iowa; attended Northwest Missouri State University, Maryville, Mo., 1967-1970; \r', 'business owner; member of the Iowa state senate, 1996-2002; elected as a \r', 'Republican to the One Hundred Eighth and to the seven succeeding Congresses \r', '(January 3, 2003-present).\r']",K000362,0,0,0,0,0,0,0,0,0,0,0,1
"KINGSTON, Jack","['a Representative from Georgia; born in Bryan, Brazos County, Tex., \r', 'April 24, 1955; graduated from Clarke Central High School, Athens, Ga.; \r', 'attended Michigan State University, East Lansing, Mich., 1973-1974; A.B., \r', 'University of Georgia, Athens, Ga., 1978; business executive; member of the \r', 'Georgia state house of representatives, 1985-1993; elected as a Republican to \r', 'the One Hundred Third and to the ten succeeding Congresses (January 3, \r', '1993-January 3, 2015); unsuccessful candidate for nomination to the United \r', 'States Senate in 2014.\r']",K000220,1,0,0,0,0,0,0,0,0,0,0,1
"KINZINGER, Adam","['a Representative from Illinois; born in Kankakee, Kankakee County, \r', 'Ill., February 27, 1978; graduated from Normal West High School, Normal, Ill., \r', '1996; B.A., Illinois State University, Normal, Ill., 2000; sales \r', 'representative; United States Air Force and Illinois Air National Guard, \r', '2003-present; member of the McLean County, Ill., board, 1998-2003; elected as a \r', 'Republican to the One Hundred Twelfth and to the three succeeding Congresses \r', '(January 3, 2011-present).\r']",K000378,1,0,0,0,0,0,0,0,0,0,0,1
"KIRKPATRICK, Ann","['a Representative from Arizona; born in McNary, Apache County, Ariz., \r', 'March 24, 1950; graduated from Blue Ridge High School; B.A., University of \r', 'Arizona, Tucson, Ariz., 1972; J.D., University of Arizona, Tucson, Ariz., 1979; \r', 'lawyer, private practice; Coconino County, Ariz., deputy attorney, 1980; \r', 'Sedona, Ariz., city attorney; member of the Arizona state house of \r', 'representatives, 2005-2007; elected as a Democrat to the One Hundred Eleventh \r', 'Congress (January 3, 2009-January 3, 2011); unsuccessful candidate for \r', 'reelection to the One Hundred Twelfth Congress in 2010; elected as a Democrat \r', 'to the One Hundred Thirteenth and to the succeeding Congress (January 3, 2013- \r', 'January 3, 2017); was not a candidate for reelection to the One Hundred \r', 'Fifteenth Congress in 2016, but was an unsuccessful candidate for election to \r', 'the United States Senate.\r']",K000368,1,0,1,0,0,0,0,0,0,0,0,0
"KLINE, John","['a Representative from Minnesota; born in Allentown, Lehigh County, \r', 'Pa., September 6, 1947; B.A., Rice University, Houston, Tex., 1969; M.P.A., \r', 'Shippensburg University of Pennsylvania, Shippensburg, Pa., 1988; United States \r', 'Marine Corps, 1969-1994; leadership consultant; unsuccessful candidate for election to the \r', 'One Hundred Sixth Congress in 1998 and to the One Hundred \r', 'Seventh Congress in 2000; elected as a Republican to the One Hundred Eighth and \r', 'to the six succeeding Congresses (January 3, 2003-January 3, 2017); was not a candidate for reelection to the One Hundred Fifteenth Congress in 2016; chair, Committee on \r', 'Education and the Workforce (One Hundred Twelfth through One Hundred Fourteenth \r', 'Congresses).\r']",K000363,1,0,0,0,0,0,0,0,0,0,0,1
"KUSTER, Ann McLane","['a Representative from New Hampshire; born in Concord, Merrimack \r', 'County, N.H., September 5, 1956; A.B., Dartmouth College, Hanover, N.H., 1978; \r', 'J.D., Georgetown University, Washington, D.C., 1984; staff, United \r', 'States Representative Paul Norton (Pete) McCloskey, Jr., of California, \r', '1978-1981; author; lawyer, private practice; professional advocate; consultant; \r', 'unsuccessful candidate for election to the One Hundred Twelfth Congress in \r', '2010; elected as a Democrat to the One Hundred Thirteenth and to the two \r', 'succeeding Congresses (January 3, 2013-present). \r']",K000382,1,0,1,0,0,0,0,0,0,0,0,0
"LABRADOR, Ra&uacute;l R.","['a Representative from Idaho; born in Carolina, San Juan County, \r', 'Puerto Rico, December 8, 1967; B.A., Brigham Young University, Provo, Utah, \r', '1992; J.D., University of Washington, Seattle, Wash., 1995; lawyer, private \r', 'practice; member of the Idaho state house of representatives, 2006-2010; \r', 'elected as a Republican to the One Hundred Twelfth and to the three succeeding \r', 'Congresses (January 3, 2011-present).\r']",L000573,1,0,1,0,0,0,0,0,0,0,0,0
"LaMALFA, Doug","['a Representative from California; born in Oroville, Butte County, \r', 'Calif., July 2, 1960; attended Las Plumas High School, Oroville, Calif.; \r', 'graduated from Briggs High School, Briggs, Calif., 1978; A.A., Butte College, \r', 'Oroville, Calif., 1980; B.S., California Polytechnic State University, San Luis \r', 'Obispo, Calif., 1982; rice farmer; member of the California state assembly, \r', '2002-2008; member of the California state senate, 2010-2012; elected as a \r', 'Republican to the One Hundred Thirteenth and to the two succeeding Congresses \r', '(January 3, 2013-present).\r']",L000578,0,1,0,0,0,0,0,0,0,0,0,1
"LAMBORN, Doug","['a Representative from Colorado; born in Leavenworth, Leavenworth \r', 'County, Kans., May 24, 1954; graduated from Lansing High School, Lansing, \r', 'Kans.; B.S., University of Kansas, Lawrence, Kans., 1978; J.D., University of \r', 'Kansas, Lawrence, Kans., 1985; lawyer, private practice; member of the Colorado \r', 'state house of representatives, 1995-1998; member of the Colorado state senate, \r', '1998-2006, president pro tempore, 1999-2000; elected as a Republican to the One \r', 'Hundred Tenth and to the five succeeding Congresses (January 3, \r', '2007-present).\r']",L000564,0,1,1,0,0,0,0,0,0,0,0,0
"LANCE, Leonard","['a Representative from New Jersey; born in Easton, Northampton \r', 'County, Pa., June 25, 1952; graduated from North Hunterdon Regional High \r', 'School, Annandale, N.J., 1970; B.A., Lehigh University, Bethlehem, Pa., 1974; \r', 'J.D., Vanderbilt University, Nashville, Tenn., 1977; M.P.A., Princeton \r', 'University, Princeton, N.J., 1982; judicial clerk; lawyer, private practice; \r', 'member of the New Jersey state general assembly, 1991-2002; member of the New \r', 'Jersey state senate, 2002-2009, minority leader, 2004-2008; unsuccessful \r', 'candidate for election to the United States House of Representatives in 1996; \r', 'elected as a Republican to the One Hundred Eleventh and to the four succeeding \r', 'Congresses (January 3, 2009-present).\r']",L000567,1,0,1,0,0,0,0,0,0,0,0,0
"LANGEVIN, James","['a Representative from Rhode Island; born in Providence, Providence \r', 'County, R.I., April 22, 1964; B.A., Rhode Island College, Providence, R.I., \r', '1990; M.A., Harvard University, Cambridge, Mass., 1994; member of the Rhode \r', 'Island state house of representatives, 1988-1994; Rhode Island secretary of \r', 'state, 1994-2001; elected as a Democrat to the One Hundred Seventh and to the \r', 'eight succeeding Congresses (January 3, 2001-present).\r']",L000559,1,0,0,0,0,1,0,0,0,0,1,0
"LANKFORD, James","['a Senator and a Representative from Oklahoma; born in Dallas, Dallas \r', 'County, Tex., March 4, 1968; B.S., University of Texas, Austin, Tex., 1990; \r', 'M.Div., Southwestern Theological Baptist Seminary, Ft. Worth, Tex., 1994; youth \r', 'camp director, 1996-2009; elected as a Republican to the One Hundred Twelfth \r', 'and to the succeeding Congress (January 3, 2011-January 3, 2015); was not a \r', 'candidate for reelection to the House of Representatives but was elected as a \r', 'Republican to the U.S. Senate in the November 4, 2014, special election to the \r', 'unexpired portion of the term ending January 3, 2017, left vacant by the \r', 'resignation of Thomas Coburn; took the oath of office on January 3, 2015; \r', 'reelected in 2016 for the tem ending January 3, 2023.\r']",L000575,0,1,0,0,0,0,0,0,0,0,0,1
"LARSEN, Richard Ray (Rick)","['a Representative from Washington; born in Arlington, Snohomish \r', 'County, Wash., June 15, 1965; B.A., Pacific Lutheran University, Tacoma, Wash., \r', '1987; M.P.A., University of Minnesota, Minneapolis, Minn., 1990; member of the \r', 'Snohomish, Wash., county council, 1998-2000; elected as a Democrat to the One \r', 'Hundred Seventh and to the eight succeeding Congresses (January 3, \r', '2001-present).\r']",L000560,1,0,0,0,0,0,0,0,0,0,0,1
"LARSON, John B.","['a Representative from Connecticut; born in Hartford, Hartford \r', 'County, Conn., July 22, 1948; graduated East Hartford High School, Hartford, \r', 'Conn., 1967; B.A., Central Connecticut University, New Britain, Conn., 1971; \r', 'member of the East Hartford, Conn., board of education, 1977-1979; member of \r', 'the East Hartford, Conn., town council, 1979-1983; senior fellow at the Yale \r', 'Bush Center for Child Development and Social Policy, New Haven, Conn.; teacher; \r', 'businessman; member of the Connecticut state senate, 1986-1998, president pro \r', 'tempore of the Connecticut state senate, 1990-1998; elected as a Democrat to \r', 'the One Hundred Sixth and to the nine succeeding Congresses (January 3, \r', '1999-present); chairman, House Democratic Caucus (One Hundred Eleventh and One \r', 'Hundred Twelfth Congresses).\r']",L000557,1,0,0,0,0,0,0,0,0,0,0,1
"LATHAM, Thomas","['a Representative from Iowa; born in Hampton, Franklin County, Iowa, \r', 'July 14, 1948; graduated from Cal Community College, Latimer, Iowa, 1966; \r', 'attended Wartburg College, Waverly, Iowa, 1966-1967, and Iowa State University, \r', 'Ames, Iowa, 1967-1970; business owner; delegate, Republican National \r', 'Convention, 1992; elected as a Republican to the One Hundred Fourth and to the \r', 'nine succeeding Congresses (January 3, 1995-January 3, 2015); was not a \r', 'candidate for reelection to the One Hundred Fourteenth Congress in \r', '2014.\r']",L000111,0,0,0,0,0,0,0,0,0,0,0,1
"LATTA, Robert E.","[' (son of Delbert L. Latta), \r', ' a Representative from Ohio; born in Bluffton, Allen County, Ohio, \r', 'April 18, 1956; B.A., Bowling Green State University, Bowling Green, Ohio, \r', '1978; J.D., University of Toledo, Toledo, Ohio, 1981; lawyer, private practice; \r', 'Wood County, Ohio, commissioner, 1991-1996; member of the Ohio state senate, \r', '1997-2000; member of the Ohio state house of representatives, 2001-2007; \r', 'elected as a Republican to the One Hundred Tenth Congress, by special election, \r', 'to fill the vacancy caused by the death of United States Representative Paul \r', 'Eugene Gillmor, and reelected to the five succeeding Congresses (December 11, \r', '2007-present).\r']",L000566,1,0,1,0,0,0,0,0,0,0,0,0
"LEE, Barbara","[' a Representative from California; born in El Paso, El Paso County, \r', 'Tex., July 16, 1946; graduated from San Fernando High School, San Fernando, \r', 'Calif., 1964; B.A., Mills College, Oakland, Calif., 1973; M.S.W., University of \r', 'California, Berkeley, Calif., 1975; staff, United States Representative Ronald \r', 'V. Dellums of California, 1975-1987; member of the California state assembly, \r', '1991-1997; member of the California state senate, 1997-1998; elected as a \r', 'Democrat to the One Hundred Fifth Congress, by special election, to fill the \r', 'vacancy caused by the resignation of United States Representative Ron Dellums, \r', 'and reelected to the ten succeeding Congresses (April 7, 1998-present). \r']",L000551,1,0,0,0,0,0,1,0,0,0,1,0
"LEVIN, Sander Martin","[' (brother of Carl Levin), \r', 'a Representative from Michigan; born in Detroit, Wayne County, \r', 'Mich., September 6, 1931; graduated from Central High School, Detroit, Mich.; \r', 'B.A., University of Chicago, Chicago, Ill., 1952; M.A., Columbia University, \r', 'New York, N.Y., 1954; LL.B., Harvard University, Cambridge, Mass., 1957; \r', 'lawyer, private practice; member of the Michigan state senate, 1965-1970; \r', 'unsuccessful candidate for Governor of Michigan in 1970 and 1974; assistant \r', 'administrator, United States Agency for International Development, 1977-1981; \r', 'delegate, Democratic National Conventions, 1964 and 1968; elected as a Democrat \r', 'to the Ninety-eighth and to the seventeen succeeding Congresses (January 3, \r', '1983-present); chairman, Committee on Ways and Means (One Hundred Eleventh \r', 'Congress).\r']",L000263,1,0,0,0,0,1,0,0,0,0,1,0
"LEWIS, John R.","['a Representative from Georgia; born in Troy, Pike County, Ala., \r', 'February 21, 1940; attended Pike County Training School, Brundidge, Ala.; B.A., \r', 'American Baptist Theological Seminary, Nashville, Tenn., 1961; B.A., Fisk \r', 'University, Nashville, Tenn., 1967; chairman, Student Nonviolent Coordinating \r', 'Committee, 1963-1966; director of ACTION, 1977-1980; community affairs \r', 'director, National Consumer Co-op Bank, Atlanta, 1980-1986; member of the \r', 'Atlanta, Ga., city council, 1982-1986; elected as a Democrat to the One \r', 'Hundredth and to the fifteen succeeding Congresses (January 3, \r', '1987-present).\r']",L000287,1,0,0,0,0,0,0,0,0,0,0,1
"LIPINSKI, Daniel","[' (son of William Oliver Lipinski), \r', 'a Representative from Illinois; born in Chicago, Cook County, Ill., \r', 'July 15, 1966; B.S., Northwestern University, Evanston, Ill., 1988; M.S., \r', 'Stanford University, Stanford, Calif., 1989; Ph.D., Duke University, Durham, \r', 'N.C., 1998; professor, James Madison University Washington Program, Washington, \r', 'D.C., 2000; professor, University of Notre Dame, South Bend, Ind., 2000-2001; \r', 'professor, University of Tennessee, Knoxville, Tenn., 2001-2004; staff, United \r', 'States Representative George Edward Sangmeister of Illinois, 1993-1994; staff, \r', 'United States Representative Jerry Francis Costello of Illinois, 1995-1996; \r', 'staff, United States Representative Rod R. Blagojevich of Illinois, 1999-2000; \r', 'elected as a Democrat to the One Hundred Ninth and to the six succeeding \r', 'Congresses (January 3, 2005-present).\r']",L000563,0,1,0,1,0,0,1,0,0,0,1,0
"LoBIONDO, Frank A.","['a Representative from New Jersey; born in Bridgeton, Cumberland \r', 'County, N.J., May 12, 1946; graduated from Georgetown Preparatory School, \r', 'Rockville, Md., 1964; B.A., St. Joseph&#x2019;s University, Philadelphia, Pa., \r', '1968; freeholder, Cumberland County, N.J., 1985-1988; member of the New Jersey \r', 'state general assembly, 1988-1994; elected as a Republican to the One Hundred \r', 'Fourth and to the eleven succeeding Congresses (January 3, \r', '1995-present).\r']",L000554,1,0,0,0,0,0,0,0,0,0,0,1
"LOEBSACK, Dave","['a Representative from Iowa; born in Sioux City, Woodbury County, \r', 'Iowa, December 23, 1952; graduated from East High School, Sioux City, Iowa, \r', '1970; B.S., Iowa State University, Ames, Iowa, 1974; M.A., Iowa State \r', 'University, Ames, Iowa, 1976; Ph.D., University of California, Davis, Calif., \r', '1985; professor, Cornell College, Mount Vernon, Iowa; elected as a Democrat to \r', 'the One Hundred Tenth and to the five succeeding Congresses (January 3, \r', '2007-present).\r']",L000565,0,1,0,1,0,1,0,0,0,0,1,0
"LOFGREN, Zoe","['a Representative from California; born in San Mateo, San Mateo \r', 'County, Calif., December 21, 1947; B.A., Stanford University, Stanford, Calif., \r', '1970; J.D., Santa Clara University School of Law, Santa Clara, Calif., 1975; \r', 'lawyer, private practice; faculty, Santa Clara University School of Law, Santa \r', 'Clara, Calif., 1978-1980; staff, United States Representative William Donlon \r', '(Don) Edwards of California, 1970-1978; executive director, Community Housing \r', 'Developers; elected as a Democrat to the One Hundred Fourth and to the eleven \r', 'succeeding Congresses (January 3, 1995-present); one of the managers appointed \r', 'by the House of Representatives in 2009 to conduct the impeachment proceedings \r', 'of Samuel B. Kent, judge of the United States District Court for the Southern \r', 'District of Texas; chair, Committee on Standards of Official Conduct (One \r', 'Hundred Eleventh Congress). \r']",L000397,1,0,1,0,0,0,0,0,0,0,0,0
"LONG, Billy","['a Representative from Missouri; born in Springfield, Greene County, \r', 'Mo., August 11, 1955; attended University of Missouri, Columbia, Mo., \r', '1973-1976; graduated from the Missouri Auction School, 1979; business owner; \r', 'radio commentator, 1999-2006; elected as a Republican to the One Hundred \r', 'Twelfth and to the three succeeding Congresses (January 3, \r', '2011-present).\r']",L000576,0,0,0,0,0,0,0,0,0,0,0,1
"LOWENTHAL, Alan","['a Representative from California; born in New York, New York County, \r', 'N.Y., March 8, 1941; B.A., Hobart College, Geneva, N.Y., 1962; M.A., Ohio State \r', 'University, Columbus, Ohio, 1965; Ph.D., Ohio State University, Columbus, Ohio, \r', '1967; professor, California State University, Long Beach, Calif., 1969-1998; \r', 'psychologist; member of the Long Beach, Calif., city council, 1992-1998; member \r', 'of the California state assembly, 1998-2004; member of the California state \r', 'senate, 2004-2012; elected as a Democrat to the One Hundred Thirteenth and to \r', 'the two succeeding Congresses (January 3, 2013-present).\r']",L000579,1,0,0,1,0,1,0,0,0,0,1,0
"LOWEY, Nita M.","['a Representative from New York; born Nita Sue Melnikoff in New York, \r', 'Bronx County, N.Y., July 5, 1937; graduated from Bronx High School of Science, \r', 'Bronx, N.Y., 1955; B.S., Mount Holyoke College, South Hadley, Mass., 1959; \r', 'staff, New York secretary of state for economic development and neighborhood \r', 'preservation; deputy director, New York state division of economic opportunity, \r', '1975-1985; New York state assistant secretary of state, 1985-1987; elected as a \r', 'Democrat to the One Hundred First and to the fourteen succeeding Congresses \r', '(January 3, 1989-present).\r']",L000480,0,1,0,0,0,0,0,0,0,0,0,1
"LUCAS, Frank D.","['a Representative from Oklahoma; born in Cheyenne, Roger Mills \r', 'County, Okla., January 6, 1960; B.S., Oklahoma State University, Stillwater, \r', 'Okla., 1982; chairman, Roger Mills County, Okla., Republican Party; staff, \r', 'United States Senator Don Nickles of Oklahoma; member of the Oklahoma state \r', 'house of representatives, 1988-1994; elected as a Republican to the One Hundred \r', 'Third Congress, by special election, to fill the vacancy caused by the \r', 'resignation of United States Representative Glenn English, and reelected to the \r', 'twelve succeeding Congresses (May 10, 1994-present); chairman, Committee on \r', 'Agriculture (One Hundred Twelfth and One Hundred Thirteenth \r', 'Congresses).\r']",L000491,0,1,0,0,0,0,0,0,0,0,0,1
"LUETKEMEYER, Blaine","['a Representative from Missouri; born in Jefferson City, Cole County, \r', 'Mo., May 7, 1952; B.A., Lincoln University, Jefferson City, Mo., 1974; business \r', 'owner; banker; rancher; member of the St. Elizabeth, Mo., board of trustees, \r', '1978-1987; member of the Missouri state house of representatives, 1999-2005; \r', 'director, tourism commission of Missouri, 2006-2008; elected as a Republican to \r', 'the One Hundred Eleventh and to the four succeeding Congresses (January 3, \r', '2009-present).\r']",L000569,1,0,0,0,0,0,0,0,0,0,0,1
"LUJ&Aacute;N, Ben Ray","['a Representative from New Mexico; born in Santa Fe, Santa Fe County, \r', 'N.Mex., June 7, 1972; graduated from Pojoaque Valley High School, Santa Fe, N. \r', 'Mex., 1990; attended University of New Mexico, Albuquerque, N.Mex., 1990-1995; \r', 'B.B.A., New Mexico Highlands University, Las Vegas, N.Mex., 2007; member of the \r', 'N.Mex. public regulation commission, 2004-2008; chairman, N.Mex. public \r', 'regulation commission, 2005-2007; N.Mex. deputy state treasurer; director of \r', 'administrative services, N.Mex. state cultural affairs department; chief \r', 'financial officer, N.Mex. state cultural affairs department; elected as a \r', 'Democrat to the One Hundred Eleventh and to the four succeeding Congresses \r', '(January 3, 2009-present).\r']",L000570,1,0,0,0,0,0,0,0,0,0,0,1
"LUJAN GRISHAM, Michelle","['a Representative from New Mexico; born in Los Alamos, Los Alamos \r', 'County, N.Mex., October 24, 1959; graduated from St. Michael&#146;s High School, \r', 'Santa Fe, N.Mex., 1977; B.S., University of New Mexico, Albuquerque, N.Mex., \r', '1981; J.D., University of New Mexico, 1987; lawyer, New Mexico state bar \r', 'association; business executive; director, New Mexico state agency on aging, \r', '1991-2002; New Mexico secretary of aging and long-term services, 2002-2004; New \r', 'Mexico secretary of health, 2004-2007; unsuccessful nominee for election to the \r', 'One Hundred Eleventh Congress in 2008; Bernalillo County, N.Mex., board of \r', 'commissioners, 2010-2012; elected as a Democrat to the One Hundred Thirteenth \r', 'Congress and to the two succeeding Congresses (January 3, \r', '2013-present).\r']",L000580,0,1,1,0,0,0,0,0,0,0,0,0
"LUMMIS, Cynthia M.","['a Representative from Wyoming; born in Cheyenne, Laramie County, Wyo., September 10, 1954; B.S., University of Wyoming, Laramie, Wyo., 1976; B.A., University of Wyoming, 1978; J.D., University of Wyoming College of Law, Laramie, Wyo., 1985; rancher; lawyer, private practice; staff, Wyoming Governor Jim Geringer, 1994-1996; member of Wyoming state house of representatives, 1979-1983, 1985-1993; member of Wyoming state senate, 1993-1995; Wyoming state treasurer, 1999-2007; Wyoming state lands and investment acting director, 1997-1998; elected as a Republican to the One Hundred Eleventh and to the three succeeding Congresses (January 3, 2009-January 3, 2017); was not a candidate for reelection to the One Hundred Fifteenth Congress in 2016. \r']",L000571,1,1,1,0,0,0,0,0,0,0,0,0
"LYNCH, Stephen F.","['a Representative from Massachusetts; born in Boston, Suffolk County, \r', 'Mass., March 31, 1955; graduated from South Boston High School, Boston, Mass., \r', '1973; B.S., Wentworth Institute, Boston, Mass., 1988; J.D., Boston College, \r', 'Chestnut Hill, Mass., 1991; M.A., Harvard University, Cambridge, Mass., 1998; \r', 'member of the Massachusetts state house of representatives, 1995-1996; member \r', 'of the Massachusetts state senate, 1997-2001; elected as a Democrat to the One \r', 'Hundred Seventh Congress, by special election, to fill the vacancy caused by \r', 'the death of United States Representative Joseph Moakley, and reelected to the \r', 'eight succeeding Congresses (October 16, 2001-present).\r']",L000562,0,1,1,0,0,1,0,0,0,0,1,0
