Name,Bio,Identifier,B.A.,B.S.,J.D.,Ph.D.,M.B.A,M.A.,M.S.,M.P.H.,M.D.,D.M.D.,non-JD,none
"PITTENGER, Robert","['a Representative from North Carolina; born in Dallas, Dallas County, \r', 'Tex., August 15, 1948; B.A., University of Texas, Austin, Tex., 1970; assistant to president of campus \r', 'ministry organization; business owner; member of the North Carolina state senate, \r', '2003-2008; unsuccessful candidate for lieutenant governor of North Carolina in \r', '2008; elected as a Republican to the One Hundred Thirteenth and to the two \r', 'succeeding Congresses (January 3, 2013-present).\r']",P000606,1,0,0,0,0,0,0,0,0,0,0,1
"PITTS, Joseph R.","['a Representative from Pennsylvania; born in Lexington, Fayette \r', 'County, Ky., October 10, 1939; B.A., Asbury College, Wilmore, Ky., 1961; M.Ed., \r', 'West Chester University of Pennsylvania, West Chester, Pa., 1972; United States \r', 'Air Force, 1963-1969; business owner; teacher; member of the Pennsylvania state \r', 'house of representatives, 1973-1997; elected as a Republican to the One Hundred \r', 'Fifth and to the nine succeeding Congresses (January 3, 1997-January 3, 2017); \r', 'was not a candidate for reelection to the One Hundred Fifteenth Congress in \r', '2016.\r']",P000373,1,0,0,0,0,0,0,0,0,0,0,1
"POCAN, Mark","['a Representative from Wisconsin; born in Kenosha, Kenosha County, \r', 'Wis., August 14, 1964; graduated from Mary D. Bradford High School, Kenosha, \r', 'Wis., 1982; B.A., University of Wisconsin, Madison, Wis., 1986; businessman; \r', 'member of the Dane County, Wis., board of supervisors, 1991-1996; member of the \r', 'Wisconsin state assembly, 1999-2013; elected as a Democrat to the One Hundred \r', 'Thirteenth and to the two succeeding Congresses (January 3, \r', '2013-present).\r']",P000607,1,0,0,0,0,0,0,0,0,0,0,1
"POE, Ted","['a Representative from Texas; born in Temple, Bell County, Tex., September 10, 1948; B.A., Abilene Christian University, Abilene, Tex., 1970; J.D., University of Houston, Houston, Tex., 1973; United States Air Force Reserves, 1970-1976; teacher; lawyer, private practice; district attorney, Harris County, Houston, Tex., 1973-1981; district judge, Harris County, Houston, Tex., 1981-2003; elected as a Republican to the One Hundred Ninth and to the six succeeding Congresses (January 3, 2005-present). \r']",P000592,1,0,1,0,0,0,0,0,0,0,0,0
"POLIS, Jared","['a Representative from Colorado; born in Boulder, Boulder County, \r', 'Colo., May 12, 1975; A.B., Princeton University, Princeton, N. J., 1996; \r', 'business owner; entrepreneur; member of the Colorado state board of education, \r', '2001-2007; chairman of the Colorado state board of education, 2004-2005; \r', 'elected as a Democrat to the One Hundred Eleventh and to the four succeeding \r', 'Congresses (January 3, 2009-present).\r']",P000598,1,0,0,0,0,0,0,0,0,0,0,1
"POMPEO, Mike","['a Representative from Kansas; born in Orange, Orange County, Calif., December 30, 1963; B.S., United States Military Academy, West Point, N.Y., 1986; J.D., Harvard University, Cambridge, Mass., 1994; United States Army, 1986-1991; business executive; elected as a Republican to the One Hundred Twelfth and to the three succeeding Congresses until his resignation on January 23, 2017 (January 3, 2011-January 23, 2017); director, Central Intelligence Agency, 2017-2018; Secretary of State in the Cabinet of President Donald J. Trump, 2018-present. \r']",P000602,0,1,1,0,0,0,0,0,0,0,0,0
"POSEY, Bill","['a Representative from Florida; born in Washington, D.C., December \r', '18, 1947; graduated from Cocoa High School, Cocoa, Fla., 1966; A.A., Eastern \r', 'Florida State College, Cocoa, Fla., 1969; Realtor; member of the Rockledge, \r', 'Fla., city council, 1976-1986; member of the Florida state house of \r', 'representatives, 1992-2000; member of the Florida state senate, 2000-2008; \r', 'elected as a Republican to the One Hundred Eleventh and to the four succeeding \r', 'Congresses (January 3, 2009-present). \r']",P000599,0,0,0,0,0,0,0,0,0,0,0,1
"PRICE, David Eugene","['a Representative from North Carolina; born in Erwin, Unicoi County, \r', 'Tenn., August 17, 1940; graduated from Unicoi County High School, Erwin, Tenn., \r', '1957; attended Mars Hill College, Mars Hill, N.C., 1957-1959; B.A., University \r', 'of North Carolina, Chapel Hill, N.C., 1961; B.D., Yale University, New Haven, \r', 'Conn., 1964; Ph.D., Yale University, New Haven, Conn., 1969; faculty, Yale \r', 'University, New Haven, Conn., 1967-1973; staff, United States Senator Edward \r', 'Lewis Bartlett of Alaska, 1963-1967; professor, Duke University, Durham, N.C., \r', '1973-1986 and 1995-1996; staff director, commission on presidential nomination, \r', 'Democratic National Committee, 1981-1982; chairman, North Carolina Democratic \r', 'Party, 1983-1984; elected as a Democrat to the One Hundredth and to the three \r', 'succeeding Congresses (January 3, 1987-January 3, 1995); unsuccessful candidate \r', 'for reelection to the One Hundred Fourth Congress in 1994; elected as a \r', 'Democrat to the One Hundred Fifth and to the ten succeeding Congresses (January \r', '3, 1997-present). \r']",P000523,1,0,0,1,0,0,0,0,0,0,1,0
"PRICE, Tom","['a Representative from Georgia; born in Lansing, Ingham County, \r', 'Mich., October 8, 1954; graduated from Dearborn High School, Dearborn, Mich., \r', '1972; A.B., University of Michigan, Ann Arbor, Mich., 1976; M.D., University of \r', 'Michigan, Ann Arbor, Mich., 1979; physician; member of the Georgia state \r', 'senate, 1997-2004; elected as a Republican to the One Hundred Ninth and to the \r', 'six succeeding Congresses until his resignation on February 10, 2017 (January \r', '3, 2005-February 10, 2017); chairman, Committee on Budget (One Hundred \r', 'Fourteenth Congress); Secretary of Health and Human Services in the Cabinet of \r', 'President Donald J. Trump, 2017.\r']",P000591,1,0,0,0,0,0,0,0,1,0,1,0
"QUIGLEY, Mike","['a Representative from Illinois; born in Indianapolis, Marion County, \r', 'Ind., October 17, 1958; attended Glenbard North High School, Carol Stream, \r', 'Ill.; B.A., Roosevelt University, Chicago, Ill., 1981; M.P.P., University of \r', 'Chicago, Chicago, Ill., 1985; J.D., Loyola University School of Law, Chicago, \r', 'Ill., 1989; professor; lawyer; legislative aide; member of the Cook County, \r', 'Ill., board of commissioners, 1998-2009; elected as a Democrat to the One \r', 'Hundred Eleventh Congress, by special election, to fill the vacancy caused by \r', 'the resignation of United States Representative Rahm Emanuel, and reelected to \r', 'the four succeeding Congresses (April 7, 2009-present).\r']",Q000023,1,0,1,0,0,0,0,0,0,0,0,0
"RADEL, Trey","['a Representative from Florida; born in Cincinnati, Hamilton County, \r', 'Ohio, April 20, 1976; B.A., Loyola University, Chicago, Ill., 1999; journalist; \r', 'television anchor; radio talk show host; elected as a Republican to the One \r', 'Hundred Thirteenth Congress until his resignation on January 27, 2014 (January \r', '3, 2013-January 27, 2014).\r']",R000596,1,0,0,0,0,0,0,0,0,0,0,1
"RAHALL, Nick Joe, II","['a Representative from West Virginia; born in Beckley, Raleigh \r', 'County, W.Va., May 20, 1949; graduated from Woodrow Wilson High School, \r', 'Beckley, W.Va.; A.B., Duke University, Durham, N.C., 1971; attended graduate \r', 'school, George Washington University, Washington, D.C., 1972; staff, Office of \r', 'the Majority Whip, United States Senate, 1971-1974; business owner; delegate, \r', 'Democratic National Conventions, 1972 and 1976; elected as a Democrat to the \r', 'Ninety-fifth and to the eighteen succeeding Congresses (January 3, 1977-January \r', '3, 2015); unsuccessful candidate for reelection to the One Hundred Fourteenth \r', 'Congress in 2014; chair, Committee on Natural Resources (One Hundred Tenth and \r', 'One Hundred Eleventh Congresses).\r']",R000011,1,0,0,0,0,0,0,0,0,0,0,1
"RANGEL, Charles B.","['a Representative from New York; born in New York, New York County, N.Y., June 11, 1930; attended DeWitt Clinton High School; B.S., New York University School of Commerce, New York, N.Y., 1957; LL.B. (J.D.), St. John&#x2019;s Law School, Brooklyn, N.Y., 1960; United States Army, 1948-1952; lawyer, private practice; assistant United States Attorney, Southern District of New York, 1963; counsel to speaker of the New York state assembly, 1965; counsel to the President&#x2019;s Commission to Revise the Draft Laws, 1966; secretary, New York State Penal Law and Code Revision Commission; member of the New York state assembly, 1966-1970; elected as a Democrat to the Ninety-second and to the twenty-two succeeding Congresses (January 3, 1971-January 3, 2017); censured by the U.S. House of Representatives on December 2, 2010, for misuse of congressional letterhead and financial impropriety; was not a candidate for reelection to the One Hundred Fifteenth Congress in 2016; chairman, Select Committee on Narcotics Abuse and Control (Ninety-eighth through One Hundred Third Congresses); chairman, Committee on Ways and Means (One Hundred Tenth and One Hundred Eleventh Congresses); chairman, Joint Committee on Taxation (One Hundred Eleventh Congress). \r']",R000053,0,1,1,0,0,0,0,0,0,0,0,0
"REED, Thomas W. II","['a Representative from New York; born in Joliet, Will County, Ill., \r', 'November 18, 1971; graduated from Horseheads High School, Horseheads, N.Y., \r', '1989; B.A., Alfred University, Alfred, N.Y., 1993; J.D., Ohio Northern \r', 'University, Ada, Ohio, 1996; lawyer, private practice; business owner; Mayor of \r', 'Corning, N.Y., 2008-2009; elected as a Republican to the One Hundred Eleventh \r', 'Congress, by special election, to fill the vacancy caused by the resignation of \r', 'United States Representative Eric J.J. Massa, and reelected to the four \r', 'succeeding Congresses (November 2, 2010-present).\r']",R000585,1,0,1,0,0,0,0,0,0,0,0,0
"REICHERT, David G.","['a Representative from Washington; born in Detroit Lakes, Becker \r', 'County, Minn., August 29, 1950; graduated, Kent Meridian High School, Kent, \r', 'Wash., 1968; A.A., Concordia Lutheran College, Portland, Oreg., 1970; United \r', 'States Air Force Reserve, 1971-1976; United States Air Force, 1976; police \r', 'officer, King County, Wash., 1972-1997; sheriff, King County, Wash., 1997- \r', '2004; elected as a Republican to the One Hundred Ninth and to the six \r', 'succeeding Congresses (January 3, 2005-present).\r']",R000578,0,0,0,0,0,0,0,0,0,0,0,1
"RENACCI, Jim","['a Representative from Ohio; born in Monongahela, Washington County, \r', 'Pa., December 3, 1958; graduated from Ringgold High School, Monongahela, Pa., \r', '1976; B.S., Indiana University of Pennsylvania, Indiana, Pa., 1980; business \r', 'owner; member of the Wadsworth, Ohio, board of zoning appeals, 1994-1995; \r', 'Wadsworth, Ohio, city council president, 1999-2003; mayor of Wadsworth, Ohio, \r', '2004-2008; elected as a Republican to the One Hundred Twelfth and to the three \r', 'succeeding Congresses (January 3, 2011-present).\r']",R000586,0,1,0,0,0,0,0,0,0,0,0,1
"RIBBLE, Reid","['a Representative from Wisconsin; born in Neenah, Winnebago County, \r', 'Wis., April 5, 1956; graduated from Appleton East High School, Appleton, Wis., \r', '1974; attended Grand Rapids School of Bible and Music, Grand Rapids, Mich.; \r', 'business owner; elected as a Republican to the One Hundred Twelfth and to the \r', 'two succeeding Congresses (January 3, 2011-January 3, 2017); was not a candidate for reelection to the One Hundred Fifteenth Congress in 2016.\r']",R000587,0,0,0,0,0,0,0,0,0,0,0,1
"RICE, Tom","['a Representative from South Carolina; born in Myrtle Beach, Horry \r', 'County, S.C., August 4, 1957; B.S., University of South Carolina, Columbia, \r', 'S.C., 1979; M.A., University of South Carolina, Columbia, S.C., 1982; J.D., \r', 'University of South Carolina, Columbia, S.C., 1982; lawyer, private practice; \r', 'accountant; chairman of the Horry County, S.C., council, 2010-2012; elected as \r', 'a Republican to the One Hundred Thirteenth and to the two succeeding Congresses \r', '(January 3, 2013-present).\r']",R000597,0,1,1,0,0,1,0,0,0,0,1,0
"RICHMOND, Cedric","['a Representative from Louisiana; born in New Orleans, Orleans \r', 'Parish, La., September 13, 1973; graduated from Benjamin Franklin High School, \r', 'New Orleans, La., 1991; B.A., Morehouse College, Atlanta, Ga., 1995; J.D., \r', 'Tulane University, New Orleans, La., 1998; member of the Louisiana state house \r', 'of representatives, 1999-2011; unsuccessful candidate for nomination to the One \r', 'Hundred Eleventh Congress in 2008; elected as a Democrat to the One Hundred \r', 'Twelfth and to the three succeeding Congresses (January 3, \r', '2011-present).\r']",R000588,1,0,1,0,0,0,0,0,0,0,0,0
"RIGELL, E. Scott","['a Representative from Virginia; born in Titusville, Brevard County, \r', 'Fla., May 28, 1960; A.A., Brevard Community College, Cocoa, Fla., 1981; B.B.A., \r', 'Mercer University, Macon, Ga., 1983; M.B.A., Regent University, Virginia Beach, \r', 'Va., 1990; United States Marine Corps Reserve, 1978-1984; entrepreneur; member \r', 'of the Virginia motor vehicle dealer board, 1995-1999; elected as a Republican \r', 'to the One Hundred Twelfth and to the two succeeding Congresses (January 3, \r', '2011-January 3, 2017); was not a candidate for reelection to the One Hundred \r', 'Fifteenth Congress in 2016.\r']",R000589,1,0,0,0,1,0,0,0,0,0,1,0
"ROBY, Martha","['a Representative from Alabama; born in Montgomery, Montgomery \r', 'County, Ala., July 27, 1976; B.M., New York University, New York, N. Y., 1998; \r', 'J.D., Samford University, Birmingham, Ala., 2001; lawyer, private practice; \r', 'member of the Montgomery, Ala., city council, 2003-2010; elected as a \r', 'Republican to the One Hundred Twelfth and to the three succeeding Congresses \r', '(January 3, 2011-present).\r']",R000591,0,0,1,0,0,0,0,0,0,0,0,0
"ROE, David P. (Phil)","['a Representative from Tennessee, born in Clarksville, Montgomery \r', 'County, Tenn., July 21, 1945; B.S., Austin Peay State University, Clarksville, \r', 'Tenn., 1967; M.D., University of Tennessee, Knoxville, Tenn., 1970; United \r', 'States Army, 1973-1974; physician; unsuccessful candidate for nomination to the \r', 'One Hundred Tenth Congress in 2006; member of the Johnson City, Tenn., board of \r', 'commissioners, 2003-2008; vice mayor of Johnson City, Tenn., 2003-2007; Mayor \r', 'of Johnson City, Tenn., 2007-2009; elected as a Republican to the One Hundred \r', 'Eleventh and to the four succeeding Congresses (January 3, 2009-present); \r', 'chair, Committee on Veterans&#146; Affairs (One Hundred Fifteenth \r', 'Congress).\r']",R000582,0,1,0,0,0,0,0,0,1,0,1,0
"ROGERS, Harold Dallas (Hal)","['a Representative from Kentucky; born in Barrier, Wayne County, Ky., \r', 'December 31, 1937; graduated from Wayne County High School, Monticello, Ky., \r', '1955; attended Western Kentucky University, Bowling Green, Ky., 1956-1957; \r', 'A.B., University of Kentucky, Lexington, Ky., 1962; LL.B., University of \r', 'Kentucky, Lexington, Ky., 1964; staff sergeant, Kentucky and North \r', 'Carolina Army National Guard, 1956-1963; lawyer, private practice; commonwealth \r', 'attorney, Pulaski and Rockcastle Counties, Ky., 1969-1980; Delegate, Republican \r', 'National Conventions, 1976, 1980, 1984, 1988, 1992, 1996, 2000, 2004, and 2008; \r', 'elected as a Republican to the Ninety-seventh and to the eighteen succeeding \r', 'Congresses (January 3, 1981-present); chair, Committee on Appropriations (One \r', 'Hundred Twelfth through One Hundred Fourteenth Congresses).\r']",R000395,1,0,0,0,0,0,0,0,0,0,0,1
"ROGERS, Mike","[' a Representative from Michigan; born in Livingston County, Mich., \r', 'June 2, 1963; graduated from Howell High School, Howell, Mich., 1981; B.S., \r', 'Adrian College, Adrian, Mich., 1985; United States Army, 1985-1989; Federal \r', 'Bureau of Investigation, 1989-1994; member of the Michigan state senate, \r', '1995-2000, and majority floor leader, 1999-2000; elected as a Republican to the \r', 'One Hundred Seventh and to the six succeeding Congresses (January 3, \r', '2001-January 3, 2015); was not a candidate for reelection to the One Hundred \r', 'Fourteenth Congress in 2014; chair, Permanent Select Committee on Intelligence \r', '(One Hundred Twelfth and One Hundred Thirteenth Congresses).\r']",R000572,0,1,0,0,0,0,0,0,0,0,0,1
"ROGERS, Mike Dennis","['a Representative from Alabama; born in Hammond, Lake County, Ind., \r', 'July 16, 1958; graduated from Saks High School, Anniston, Ala., 1976; B.A., \r', 'Jacksonville State University, Jacksonville, Ala., 1981; M.P.A., Jacksonville \r', 'State University, Jacksonville, Ala., 1984; J.D., Birmingham School of Law, \r', 'Birmingham, Ala., 1991; member of the Calhoun County, Ala., commission, \r', '1987-1990; member of the Alabama state house of representatives, 1994-2002, \r', 'minority leader, 1998-2000; elected as a Republican to the One Hundred Eighth \r', 'and to the seven succeeding Congresses (January 3, 2003-present).\r']",R000575,1,0,1,0,0,0,0,0,0,0,0,0
"ROHRABACHER, Dana","['a Representative from California; born in Coronado, San Diego \r', 'County, Calif., June 21, 1947; graduated from Palos Verdes High School, Palos \r', 'Verdes Estates, Calif., 1965; attended Los Angeles Harbor College, Los Angeles, \r', 'Calif., 1965-1967; B.A., California State University, Long Beach, Calif., 1969; \r', 'M.A., University of Southern California, Los Angeles, Calif., 1971; journalist; \r', 'assistant press secretary to the Ronald Reagan presidential campaigns of 1976 \r', 'and 1980; speechwriter and special assistant to President Ronald Reagan, \r', '1981-1988; elected as a Republican to the One Hundred First and to the fourteen \r', 'succeeding Congresses (January 3, 1989-present). \r']",R000409,1,0,0,0,0,1,0,0,0,0,1,0
"ROKITA, Todd","['a Representative from Indiana; born in Chicago, Cook County, Ill., \r', 'February 9, 1970; graduated from Munster High School, Munster, Ind., 1988; \r', 'B.A., Wabash College, Crawfordsville, Ind., 1992; J.D., Robert H. McKinney \r', 'School of Law, Indiana University, Indianapolis, Ind., 1995; lawyer, private \r', 'practice; general counsel, Indiana state secretary of state&#146;s office, \r', '1997-2000; Indiana state deputy secretary of state, 2000-2002; Indiana state \r', 'secretary of state, 2002-2010; elected as a Republican to the One Hundred \r', 'Twelfth and to the three succeeding Congresses (January 3, \r', '2011-present).\r']",R000592,1,0,1,0,0,0,0,0,0,0,0,0
"ROONEY, Thomas J.","['a Representative from Florida; born in Philadelphia, Philadelphia \r', 'County, Pa., November 21, 1970; attended Syracuse University, Syracuse, N.Y., \r', '1989; B.A., Washington and Jefferson College, Washington, Pa., 1993; M.A., \r', 'University of Florida, Gainesville, Fla., 1996; J.D., University of Miami, \r', 'Coral Gables, Fla., 1999; United States Army, 2000-2004; lawyer, private \r', 'practice; assistant attorney general, Office of the Attorney General, State of \r', 'Florida; professor, United States Military Academy, West Point, N.Y.; staff, \r', 'United States Senator Connie Mack III of Florida; elected as a Republican to \r', 'the One Hundred Eleventh and to the four succeeding Congresses (January 3, \r', '2009-present). \r']",R000583,1,0,1,0,0,1,0,0,0,0,1,0
"ROS-LEHTINEN, Ileana","['a Representative from Florida; born Ileana Ros in Havana, Cuba, July \r', '15, 1952; A.A., Miami-Dade Community College, Miami, Fla., 1972; B.A., Florida \r', 'International University, Miami, Fla., 1975; M.S., Florida International \r', 'University, Miami, Fla., 1987; Ed.D., University of Miami, Coral Gables, Fla., \r', '2004; founder, Eastern Academy; member of the Florida state house of \r', 'representatives, 1982-1986; member of the Florida state senate, 1986-1989; \r', 'elected as a Republican to the One Hundred First Congress, by special election, \r', 'to fill the vacancy caused by the death of United States Representative Claude \r', 'D. Pepper, and reelected to the fourteen succeeding Congresses (August 29, \r', '1989-present); chair, Committee on Foreign Affairs (One Hundred Twelfth \r', 'Congress).\r']",R000435,1,0,0,1,0,0,1,0,0,0,1,0
"ROSKAM, Peter","['a Representative from Illinois; born in Hinsdale, DuPage County, \r', 'Ill., September 13, 1961; B.A. University of Illinois, Urbana-Champaign, Ill., \r', '1983; J.D., Illinois Institute of Technology, Chicago, Ill., 1989; lawyer, \r', 'private practice; staff, United States Representative Thomas Dale DeLay of \r', 'Texas, 1985-1986; staff, United States Representative Henry John Hyde of \r', 'Illinois, 1986-1987; teacher; businessman; member of the Illinois state house \r', 'of representatives, 1993-1999; member of the Illinois state senate, 2000-2006; \r', 'unsuccessful candidate for nomination to the One Hundred Sixth Congress in \r', '1998; elected as a Republican to the One Hundred Tenth and to the five \r', 'succeeding Congresses (January 3, 2007-present).\r']",R000580,1,0,1,0,0,0,0,0,0,0,0,0
"ROSS, Dennis","['a Representative from Florida; born in Lakeland, Polk County, \r', 'Florida, on October 18, 1959; graduated from Lakeland Senior High School, \r', 'Lakeland, Fla., 1977; B.S., Auburn University, Auburn, Ala.; J.D., Samford \r', 'University, Birmingham, Ala.; lawyer, private practice; member of the Florida \r', 'state house of representatives, 2000-2008; elected as a Republican to the One \r', 'Hundred Twelfth and to the three succeeding Congresses (January 3, \r', '2011-present).\r']",R000593,0,1,1,0,0,0,0,0,0,0,0,0
"ROTHFUS, Keith","['a Representative from Pennsylvania; born in Endicott, Broome County, \r', 'N.Y., April 25, 1962; graduated from West Seneca West Senior High School, West \r', 'Seneca, N.Y., 1980; B.S., State University of New York-Buffalo State, Buffalo, \r', 'N.Y., 1984; J.D., University of Notre Dame, Notre Dame, Ind., 1990; lawyer, \r', 'private practice; director, Center for Faith-Based and Community Initiatives, \r', 'United States Department of Homeland Security, 2006-2007; unsuccessful \r', 'candidate for election to the One Hundred Twelfth Congress in 2010; elected as \r', 'a Republican to the One Hundred Thirteenth and to the two succeeding Congresses \r', '(January 3, 2013-present).\r']",R000598,0,1,1,0,0,0,0,0,0,0,0,0
"ROYBAL-ALLARD, Lucille","[' (daughter of Edward R. Roybal), \r', 'a Representative from California; born in Boyle Heights, Los Angeles \r', 'County, Calif., June 12, 1941; graduated from Ramona Convent Secondary School, \r', 'Alhambra, Calif., 1959; B.A., California State University, Los Angeles, Calif., \r', '1965; community relations and nonprofit executive; member of the California \r', 'state assembly, 1987-1992; elected as a Democrat to the One Hundred Third and \r', 'to the twelve succeeding Congresses (January 3, 1993-present). \r']",R000486,1,0,0,0,0,0,0,0,0,0,0,1
"ROYCE, Edward Randall","['a Representative from California; born in Los Angeles, Los Angeles \r', 'County, Calif., October 12, 1951; B.A., California State University, Fullerton, \r', 'Calif., 1977; business owner; corporate tax manager; member of the California \r', 'state senate, 1983-1993; elected as a Republican to the One Hundred Third and \r', 'to the twelve succeeding Congresses (January 3, 1993-present); chair, Committee \r', 'on Foreign Affairs (One Hundred Thirteenth through One Hundred Fifteenth \r', 'Congresses). \r']",R000487,1,0,0,0,0,0,0,0,0,0,0,1
"RUIZ, Raul","['a Representative from California; born in Zacatecas, Mexico, August \r', '25, 1972; graduated from Coachella Valley High School, Coachella, Calif., 1990; \r', 'B.S., University of California, Los Angeles, Calif., 1994; M.D., Harvard \r', 'University, Cambridge, Mass., 2001; M.P.P., Harvard University, Cambridge, \r', 'Mass., 2001; M.P.H., Harvard University, Cambridge, Mass., 2007; physician; \r', 'associate dean, University of California-Riverside School of Medicine, \r', 'Riverside, Calif., 2011-2012; elected as a Democrat to the One Hundred \r', 'Thirteenth and to the two succeeding Congresses (January 3, \r', '2013-present).\r']",R000599,0,1,0,0,0,0,0,1,1,0,1,0
"RUNYAN, Jon","['a Representative from New Jersey; born in Flint, Genessee County, \r', 'Mich., November 27, 1973; graduated from Carman-Ainsworth High School, Flint, \r', 'Mich.; attended University of Michigan, Ann Arbor, Mich., 1992-1995; attended \r', 'University of Pennsylvania, Wharton School of Business, Philadelphia, Pa.; \r', 'professional athlete; television commentator; elected as a Republican to the \r', 'One Hundred Twelfth and to the succeeding Congress (January 3, 2011-January 3, \r', '2015); was not a candidate for reelection to the One Hundred Fourteenth \r', 'Congress in 2014.\r']",R000594,0,0,0,0,0,0,0,0,0,0,0,1
"RUPPERSBERGER, C. A. (Dutch)","['a Representative from Maryland; born in Baltimore, Md., on January \r', '31, 1946; graduated from Baltimore City College, Baltimore, Md., 1963; attended \r', 'University of Maryland, College Park, Md.; J.D., University of Baltimore School \r', 'of Law, Baltimore, Md., 1970; lawyer, private practice; assistant Maryland \r', 'state&#146;s attorney, 1972-1980; member of the Baltimore County, Md., county \r', 'council, 1985-1994; delegate, Democrat National Convention, 1996 and 2000; \r', 'Baltimore, Md., county executive, 1994-2002; elected as a Democrat to the One \r', 'Hundred Eighth and to the seven succeeding Congresses (January 3, \r', '2003-present).\r']",R000576,0,0,1,0,0,0,0,0,0,0,0,0
