(1) went to new D (2) went to new R (3) open seat to D (4) open seat to R (5) Pa: didn’t return,,,2011,2013,2015,2017,2019,State,BA,BS,JD,PhD,MBA,MPA/MPP,MA ,MS,MPH,MD,DMD,Other bachelors,Other postgrad,JDs,Has a non-JD postgraduate degree,Has a MD,Has a bachelors or above,JD + another postgrad degree,Has a postgraduate degree,BS and Replaced,BA,BA and Replaced,NO BA or BS and Replaced,New Member,BA (Replacement),BS (Replacement),JD (Replacement),PhD (Replacement,MBA (Replacement),MPA/MPP (Replacement),MA (Replacement),MS (Replacement),MPH (Replacement),MD (Replacement),DMD (Replacement),Other bachelors,Other postgrad,,
,"Henry Cuellar, D-Texas","Laredo Community College, A.A. 1976 (political science)
Georgetown U., B.S.F.S. 1978
U. of Texas, J.D. 1981
Laredo State U., M.B.A. 1982 (international trade)
U. of Texas, Ph.D. 1998 (government)",,,1,1,1,Texas,1,1,1,1,1,0,0,0,0,0,0,,,1,1,0,0,1,0,FALSE,1,FALSE,FALSE,FALSE,0,0,0,0,0,0,0,0,0,0,0,0,0,,
,"Doug Collins, R-Ga.","North Georgia College, B.S. 1988 (political science)
New Orleans Baptist Theological Seminary, M.Div. 1996
John Marshall Law School (Ga.), J.D. 2008",,,1,1,1,Ga.,0,1,1,0,0,0,0,0,0,1,0,,,1,1,1,0,1,0,FALSE,FALSE,FALSE,FALSE,FALSE,0,0,0,0,0,0,0,0,0,0,0,0,0,,
,"Jim Jordan, R-Ohio","U. of Wisconsin, B.S. 1986 (economics)
Ohio State U., M.A. 1991 (education)
Capital U., J.D. 2001",,,1,1,1,Ohio,0,1,1,0,0,0,1,0,0,0,0,,,1,1,0,0,1,0,FALSE,FALSE,FALSE,FALSE,FALSE,0,0,0,0,0,0,0,0,0,0,0,0,0,,
,"Stephen F. Lynch, D-Mass.","Wentworth Institute of Technology, B.S. 1988 (construction management)
Boston College, J.D. 1991
Harvard U., M.A. 1998 (public administration)",,,1,1,1,Mass.,0,1,1,0,0,0,1,0,0,0,0,,,1,1,0,0,1,0,FALSE,FALSE,FALSE,FALSE,FALSE,0,0,0,0,0,0,0,0,0,0,0,0,0,,
,"Tom Rice, R-S.C.","U. of South Carolina, B.S. 1979 (accounting)
U. of South Carolina, J.D. 1982
U. of South Carolina, M.Acc. 1982 (accounting)",,,1,1,1,S.C.,0,1,1,0,0,0,1,0,0,0,0,,,1,1,0,0,1,0,FALSE,FALSE,FALSE,FALSE,FALSE,0,0,0,0,0,0,0,0,0,0,0,0,0,,
,"Eliot L. Engel, D-N.Y.","Hunter-Lehman College, B.A. 1969 (history)
City U. of New York, Lehman College, M.A. 1973 (guidance & counseling)
New York Law School, J.D. 1987",,,1,1,1,N.Y.,1,0,1,0,0,0,1,0,0,0,0,,,1,1,0,0,1,0,FALSE,1,FALSE,FALSE,FALSE,0,0,0,0,0,0,0,0,0,0,0,0,0,,
,"Hakeem Jeffries, D-N.Y.","State U. of New York, Binghamton, B.A. 1992 (African studies & political science)
Georgetown U., M.P.P. 1994
New York U., J.D. 1997",,,1,1,1,N.Y.,1,0,1,0,0,1,0,0,0,0,0,,,1,1,0,0,1,0,FALSE,1,FALSE,FALSE,FALSE,0,0,0,0,0,0,0,0,0,0,0,0,0,,
,"Katherine M. Clark, D-Mass.","St. Lawrence U., B.A. 1985 (history)
Cornell U., J.D. 1989
Harvard U., M.P.A. 1997",,,1,1,1,Mass.,1,0,1,0,0,1,0,0,0,0,0,,,1,1,0,0,1,0,FALSE,1,FALSE,FALSE,FALSE,0,0,0,0,0,0,0,0,0,0,0,0,0,,
,"Jim Cooper, D-Tenn.","U. of North Carolina, B.A. 1975 (history & economics)
Oxford U., B.A., M.A. 1977 (Rhodes scholar)
Harvard U., J.D. 1980",,,1,1,1,Tenn.,1,0,1,0,0,0,1,0,0,0,0,,,1,1,0,0,1,0,FALSE,1,FALSE,FALSE,FALSE,0,0,0,0,0,0,0,0,0,0,0,0,0,,
,"William Keating, D-Mass.","Boston College, B.A. 1974 (political science)
Boston College, M.B.A. 1982
Suffolk U., J.D. 1985",,,1,1,1,Mass.,1,0,1,0,1,0,0,0,0,0,0,,,1,1,0,0,1,0,FALSE,1,FALSE,FALSE,FALSE,0,0,0,0,0,0,0,0,0,0,0,0,0,,
,"Ron Kind, D-Wis.","Harvard U., A.B. 1985
London School of Economics, M.A. 1986
U. of Minnesota, J.D. 1990",,,1,1,1,Wis.,1,0,1,0,0,0,1,0,0,0,0,,,1,1,0,0,1,0,FALSE,1,FALSE,FALSE,FALSE,0,0,0,0,0,0,0,0,0,0,0,0,0,,
,"Frank Pallone Jr., D-N.J.","Middlebury College, B.A. 1973 (history & French)
Tufts U., M.A. 1974 (international relations)
Rutgers U., J.D. 1978",,,1,1,1,N.J.,1,0,1,0,0,0,1,0,0,0,0,,,1,1,0,0,1,0,FALSE,1,FALSE,FALSE,FALSE,0,0,0,0,0,0,0,0,0,0,0,0,0,,
,"Mike Quigley, D-Ill.","Roosevelt U., B.A. 1981 (political science)
U. of Chicago, M.P.P 1985
Loyola U. Chicago, J.D. 1989",,,1,1,1,Ill.,1,0,1,0,0,1,0,0,0,0,0,,,1,1,0,0,1,0,FALSE,1,FALSE,FALSE,FALSE,0,0,0,0,0,0,0,0,0,0,0,0,0,,
,"Mike D. Rogers, R-Ala.","Jacksonville State U., B.A. 1981 (political science & psychology)
Jacksonville State U., M.P.A. 1985
Birmingham School of Law, J.D. 1991",,,1,1,1,Ala.,1,0,1,0,0,1,0,0,0,0,0,,,1,1,0,0,1,0,FALSE,1,FALSE,FALSE,FALSE,0,0,0,0,0,0,0,0,0,0,0,0,0,,
,"Terri A. Sewell, D-Ala.","Princeton U., A.B. 1986 (public and international affairs)
Oxford U., M.A. 1988 (Marshall scholar)
Harvard U., J.D. 1992",,,1,1,1,Ala.,1,0,1,0,0,0,1,0,0,0,0,,,1,1,0,0,1,0,FALSE,1,FALSE,FALSE,FALSE,0,0,0,0,0,0,0,0,0,0,0,0,0,,
,"Michael R. Turner, R-Ohio","Ohio Northern U., B.A. 1982 (political science)
Case Western Reserve U., J.D. 1985
U. of Dayton, M.B.A. 1992",,,1,1,1,Ohio,1,0,1,0,1,0,0,0,0,0,0,,,1,1,0,0,1,0,FALSE,1,FALSE,FALSE,FALSE,0,0,0,0,0,0,0,0,0,0,0,0,0,,
,"Juan C. Vargas, D-Calif.","U. of San Diego, B.A. 1983 (political science)
Fordham U., M.A. 1987 (philosophy)
Harvard U., J.D. 1991",,,1,1,1,Calif.,1,0,1,0,0,0,1,0,0,0,0,,,1,1,0,0,1,0,FALSE,1,FALSE,FALSE,FALSE,0,0,0,0,0,0,0,0,0,0,0,0,0,,
,"Alma Adams, D-N.C.","North Carolina A&T U., B.S. 1969 (art education)
North Carolina A&T U., M.S. 1972 (art education)
Ohio State U., Ph.D. 1981 (art education)",,,1,1,1,N.C.,0,1,0,1,0,0,0,1,0,0,0,,,0,1,0,0,0,0,FALSE,FALSE,FALSE,1,FALSE,0,0,0,0,0,0,0,0,0,0,0,0,0,,
,"Daniel Lipinski, D-Ill.","Northwestern U., B.S. 1988 (mechanical engineering)
Stanford U., M.S. 1989 (engineering-economic systems)
Duke U., Ph.D. 1998 (political science)",,,1,1,1,Ill.,0,1,0,1,0,0,0,1,0,0,0,,,0,1,0,0,0,0,FALSE,FALSE,FALSE,1,FALSE,0,0,0,0,0,0,0,0,0,0,0,0,0,,
,"Dave Loebsack, D-Iowa","Iowa State U., B.S. 1974 (political science)
Iowa State U., M.A. 1976 (political science)
U. of California, Davis, Ph.D. 1985 (political science)",,,1,1,1,Iowa,0,1,0,1,0,0,1,0,0,0,0,,,0,1,0,0,0,0,FALSE,FALSE,FALSE,1,FALSE,0,0,0,0,0,0,0,0,0,0,0,0,0,,
,"Jerry McNerney, D-Calif.","U.S. Military Academy, attended 1969-71
U. of New Mexico, B.S. 1973 (mathematics)
U. of New Mexico, M.S. 1975 (mathematics)
U. of New Mexico, Ph.D. 1981 (mathematics)",,,1,1,1,Calif.,0,1,0,1,0,0,0,1,0,0,0,,,0,1,0,0,0,0,FALSE,FALSE,FALSE,1,FALSE,0,0,0,0,0,0,0,0,0,0,0,0,0,,
,"Rob Wittman, R-Va.","Virginia Polytechnic Institute and State U., B.S. 1981 (biology)
U. of North Carolina, M.P.H. 1990 (health policy and administration)
Virginia Commonwealth U., Ph.D. 2002 (public policy and administration)",,,1,1,1,Va.,0,1,0,1,0,0,0,0,1,0,0,,,0,1,0,0,0,0,FALSE,FALSE,FALSE,1,FALSE,0,0,0,0,0,0,0,0,0,0,0,0,0,,
,"Tom Cole, R-Okla.","Grinnell College, B.A. 1971 (history)
Yale U., M.A. 1974 (British history)
U. of Oklahoma, Ph.D. 1984 (19th Century British history)",,,1,1,1,Okla.,1,0,0,1,0,0,1,0,0,0,0,,,0,1,0,0,0,0,FALSE,1,FALSE,FALSE,FALSE,0,0,0,0,0,0,0,0,0,0,0,0,0,,
,"Judy Chu, D-Calif.","U. of California, Santa Barbara, attended 1970-73
U. of California, Los Angeles, B.A. 1974 (mathematics)
California School of Professional Psychology, Los Angeles, Ph.D. 1979 (clinical psychology)",,,1,1,1,Calif.,1,0,0,1,0,0,0,0,0,0,0,,,0,1,0,0,0,0,FALSE,1,FALSE,FALSE,FALSE,0,0,0,0,0,0,0,0,0,0,0,0,0,,
,"Danny K. Davis, D-Ill.","Arkansas AM&N College, B.A. 1961 (history & education)
Chicago State U., M.A. 1968 (guidance)
Union Institute, Ph.D. 1977 (public administration)",,,1,1,1,Ill.,1,0,0,1,0,0,1,0,0,0,0,,,0,1,0,0,0,0,FALSE,1,FALSE,FALSE,FALSE,0,0,0,0,0,0,0,0,0,0,0,0,0,,
,"Bill Foster, D-Ill.","U. of Wisconsin, B.A. 1976 (physics)
Harvard U., Ph.D. 1983 (experimental physics)",,,1,1,1,Ill.,1,0,0,1,0,0,0,0,0,0,0,,,0,1,0,0,0,0,FALSE,1,FALSE,FALSE,FALSE,0,0,0,0,0,0,0,0,0,0,0,0,0,,
,"Robin Kelly, D-Ill.","Bradley U., B.A. 1978 (psychology)
Bradley U., M.A. 1982 (counseling)
Northern Illinois U., Ph.D. 2004 (political science)",,,1,1,1,Ill.,1,0,0,1,0,0,1,0,0,0,0,,,0,1,0,0,0,0,FALSE,1,FALSE,FALSE,FALSE,0,0,0,0,0,0,0,0,0,0,0,0,0,,
,"Alan Lowenthal, D-Calif.","Hobart College, B.A. 1962 (psychology)
Ohio State U., M.A. 1965 (psychology)
Ohio State U., Ph.D. 1967 (psychology)",,,1,1,1,Calif.,1,0,0,1,0,0,1,0,0,0,0,,,0,1,0,0,0,0,FALSE,1,FALSE,FALSE,FALSE,0,0,0,0,0,0,0,0,0,0,0,0,0,,
,"David E. Price, D-N.C.","Mars Hill College, attended 1957-59
U. of North Carolina, B.A. 1961 (American history & math)
Yale U., B.D. 1964 (theology)
Yale U., Ph.D. 1969 (political science)",,,1,1,1,N.C.,1,0,0,1,0,0,0,0,0,0,0,,,0,1,0,0,0,0,FALSE,1,FALSE,FALSE,FALSE,0,0,0,0,0,0,0,0,0,0,0,0,0,,
,"Dina Titus, D-Nev.","College of William & Mary, A.B 1970 (government)
U. of Georgia, M.A. 1973 (political science)
Florida State U., Ph.D. 1976 (political science)",,,1,1,1,Nev.,1,0,0,1,0,0,1,0,0,0,0,,,0,1,0,0,0,0,FALSE,1,FALSE,FALSE,FALSE,0,0,0,0,0,0,0,0,0,0,0,0,0,,
,"Ralph Abraham, R-La.","Louisiana State U., B.S., D.V.M. 1980
Louisiana State U., M.D. 1994",,,1,1,1,La.,0,1,0,0,0,0,0,0,0,1,0,,,0,1,1,0,0,0,FALSE,FALSE,FALSE,FALSE,FALSE,0,0,0,0,0,0,0,0,0,0,0,0,0,,
,"Ami Bera, D-Calif.","U. of California, Irvine, B.S. 1987 (biological sciences)
U. of California, Irvine, M.D. 1991",,,1,1,1,Calif.,0,1,0,0,0,0,0,0,0,1,0,,,0,1,1,0,0,0,FALSE,FALSE,FALSE,1,FALSE,0,0,0,0,0,0,0,0,0,0,0,0,0,,
,"Larry Bucshon, R-Ind.","U. of Illinois, B.S. 1984 (chemistry)
U. of Illinois, Chicago, M.D. 1988",,,1,1,1,Ind.,0,1,0,0,0,0,0,0,0,1,0,,,0,1,1,0,0,0,FALSE,FALSE,FALSE,1,FALSE,0,0,0,0,0,0,0,0,0,0,0,0,0,,
,"Michael C. Burgess, R-Texas","North Texas State U., B.S. 1972 (biology)
North Texas State U., M.S. 1976 (physiology)
U. of Texas Health Science Center, Houston, M.D. 1977
U. of Texas Southwestern Medical Center, Dallas, M.S. 2000 (medical management)",,,1,1,1,Texas,0,1,0,0,0,0,0,1,0,1,0,,,0,1,1,0,0,0,FALSE,FALSE,FALSE,1,FALSE,0,0,0,0,0,0,0,0,0,0,0,0,0,,
,"Emanuel Cleaver II, D-Mo.","Murray State College (Okla.), attended 1963-64
Prairie View A&M College, B.S. 1972 (sociology)
Saint Paul School of Theology, M.Div. 1974",,,1,1,1,Mo.,0,1,0,0,0,0,0,0,0,1,0,,,0,1,1,0,0,0,FALSE,FALSE,FALSE,1,FALSE,0,0,0,0,0,0,0,0,0,0,0,0,0,,
,"Paul Cook, R-Calif.","Southern Connecticut State U., B.S. 1966 (education)
California State U., San Bernardino, M.P.A. 1996
U. of California, Riverside, M.A. 2000 (political science)",,,1,1,1,Calif.,0,1,0,0,0,1,1,0,0,0,0,,,0,1,0,0,0,0,FALSE,FALSE,FALSE,1,FALSE,0,0,0,0,0,0,0,0,0,0,0,0,0,,
,"Scott DesJarlais, R-Tenn.","U. of South Dakota, B.S. 1987 (chemistry & psychology)
U. of South Dakota, M.D. 1991",,,1,1,1,Tenn.,0,1,0,0,0,0,0,0,0,1,0,,,0,1,1,0,0,0,FALSE,FALSE,FALSE,1,FALSE,0,0,0,0,0,0,0,0,0,0,0,0,0,,
,"Debbie Dingell, D-Mich.","Georgetown U., B.S.F.S. 1992
Georgetown U., M.A. 1998 (liberal studies)",,,1,1,1,Mich.,0,1,0,0,0,0,1,0,0,0,0,,,0,1,0,0,0,0,FALSE,FALSE,FALSE,1,FALSE,0,0,0,0,0,0,0,0,0,0,0,0,0,,
,"Brett Guthrie, R-Ky.","U.S. Military Academy, B.S. 1987 (mathematical economics)
Yale U., M.P.P.M 1997",,,1,1,1,Ky.,0,1,0,0,0,1,0,0,0,0,0,,,0,1,0,0,0,0,FALSE,FALSE,FALSE,1,FALSE,0,0,0,0,0,0,0,0,0,0,0,0,0,,
,"Vicky Hartzler, R-Mo.","U. of Missouri, B.S. 1983 (home economics & education)
Central Missouri State U., M.S. 1992 (education)",,,1,1,1,Mo.,0,1,0,0,0,0,0,1,0,0,0,,,0,1,0,0,0,0,FALSE,FALSE,FALSE,1,FALSE,0,0,0,0,0,0,0,0,0,0,0,0,0,,
,"Bill Johnson, R-Ohio","Troy U., B.S. 1979 (computer science)
Georgia Institute of Technology, M.S. 1984 (computer science)",,,1,1,1,Ohio,0,1,0,0,0,0,0,1,0,0,0,,,0,1,0,0,0,0,FALSE,FALSE,FALSE,1,FALSE,0,0,0,0,0,0,0,0,0,0,0,0,0,,
,"Eddie Bernice Johnson, D-Texas","Texas Christian U., B.S. 1967 (nursing)
Southern Methodist U., M.P.A. 1976",,,1,1,1,Texas,0,1,0,0,0,1,0,0,0,0,0,,,0,1,0,0,0,0,FALSE,FALSE,FALSE,1,FALSE,0,0,0,0,0,0,0,0,0,0,0,0,0,,
,"Devin Nunes, R-Calif.","College of the Sequoias, A.A. 1993 (agriculture)
California Polytechnic State U., B.S. 1995 (agricultural business)
California Polytechnic State U., M.S. 1996 (agriculture)",,,1,1,1,Calif.,0,1,0,0,0,0,0,1,0,0,0,,,0,1,0,0,0,0,FALSE,FALSE,FALSE,1,FALSE,0,0,0,0,0,0,0,0,0,0,0,0,0,,
,"Phil Roe, R-Tenn.","Austin Peay State U., B.S. 1967 (biology)
U. of Tennessee, M.D. 1973",,,1,1,1,Tenn.,0,1,0,0,0,0,0,0,0,1,0,,,0,1,1,0,0,0,FALSE,FALSE,FALSE,1,FALSE,0,0,0,0,0,0,0,0,0,0,0,0,0,,
,"Raul Ruiz, D-Calif.","U. of California, Los Angeles, B.S. 1994 (physiological science)
Harvard U., M.D. 2001
Harvard U., M.P.P. 2001
Harvard U., M.P.H. 2007",,,1,1,1,Calif.,0,1,0,0,0,1,0,0,1,1,0,,,0,1,1,0,0,0,FALSE,FALSE,FALSE,1,FALSE,0,0,0,0,0,0,0,0,0,0,0,0,0,,
,"Mike Simpson, R-Idaho","Utah State U., attended 1968-72 (pre-dentistry)
Washington U. (Mo.), D.M.D. 1977
Utah State U., B.S. 2002 (pre-dentistry)",,,1,1,1,Idaho,0,1,0,0,0,0,0,0,0,0,1,,,0,1,0,0,0,0,FALSE,FALSE,FALSE,1,FALSE,0,0,0,0,0,0,0,0,0,0,0,0,0,,
,"Tim Walberg, R-Mich.","Western Illinois U., attended 1969-70 (forestry)
Fort Wayne Bible College, B.S. 1975 (Christian education)
Wheaton College (Ill.), M.A. 1978 (communications)",,,1,1,1,Mich.,0,1,0,0,0,0,1,0,0,0,0,,,0,1,0,0,0,0,FALSE,FALSE,FALSE,1,FALSE,0,0,0,0,0,0,0,0,0,0,0,0,0,,
,"Brendan F. Boyle, D-Pa.","U. of Notre Dame, B.A. 1999 (government)
Harvard U., M.P.P. 2005",,,1,1,1,Pa.,1,0,0,0,0,1,0,0,0,0,0,,,0,1,0,0,0,0,FALSE,1,FALSE,FALSE,FALSE,0,0,0,0,0,0,0,0,0,0,0,0,0,,
,"Chris Collins, R-N.Y.","North Carolina State U., B.S. 1972 (mechanical engineering)
U. of Alabama, Birmingham, M.B.A. 1975",,,1,1,1,N.Y.,1,1,0,0,1,0,0,0,0,0,0,,,0,1,0,0,0,0,FALSE,1,FALSE,FALSE,FALSE,0,0,0,0,0,0,0,0,0,0,0,0,0,,
,"Brian Higgins, D-N.Y.","State U. of New York, Buffalo State, B.A. 1984 (political science)
State U. of New York, Buffalo State, M.A. 1985 (history)
Harvard U., M.P.A. 1996",,,1,1,1,N.Y.,1,0,0,0,0,1,1,0,0,0,0,,,0,1,0,0,0,0,FALSE,1,FALSE,FALSE,FALSE,0,0,0,0,0,0,0,0,0,0,0,0,0,,
,"Nydia M. Velázquez, D-N.Y.","U. of Puerto Rico, B.A. 1974 (political science)
New York U., M.A. 1976 (political science)",,,1,1,1,N.Y.,1,0,0,0,0,0,1,0,0,0,0,,,0,1,0,0,0,0,FALSE,1,FALSE,FALSE,FALSE,0,0,0,0,0,0,0,0,0,0,0,0,0,,
,"Joyce Beatty, D-Ohio","Central State U., B.A. 1972 (drama)
Wright State U., M.S. 1975 (mental health counseling)
U. of Cincinnati, attended 1975-79",,,1,1,1,Ohio,1,0,0,0,0,0,0,1,0,0,0,,,0,1,0,0,0,0,FALSE,1,FALSE,FALSE,FALSE,0,0,0,0,0,0,0,0,0,0,0,0,0,,
,"Julia Brownley, D-Calif.","Mount Vernon College, B.A. 1975 (political science)
American U., M.B.A. 1979",,,1,1,1,Calif.,1,0,0,0,1,0,0,0,0,0,0,,,0,1,0,0,0,0,FALSE,1,FALSE,FALSE,FALSE,0,0,0,0,0,0,0,0,0,0,0,0,0,,
,"Vern Buchanan, R-Fla.","Cleary College, B.B.A. 1975 (business administration)
U. of Detroit, M.B.A. 1986",,,1,1,1,Fla.,1,0,0,0,1,0,0,0,0,0,0,,,0,1,0,0,0,0,FALSE,1,FALSE,FALSE,FALSE,0,0,0,0,0,0,0,0,0,0,0,0,0,,
,"Cheri Bustos, D-Ill.","Illinois College, attended 1979-81
U. of Maryland, B.A. 1983 (government and politics)
U. of Illinois, Springfield, M.A. 1985 (public affairs reporting)",,,1,1,1,Ill.,1,0,0,0,0,0,1,0,0,0,0,,,0,1,0,0,0,0,FALSE,1,FALSE,FALSE,FALSE,0,0,0,0,0,0,0,0,0,0,0,0,0,,
,"André Carson, D-Ind.","Concordia U. Wisconsin, B.A. 2003 (management of criminal justice)
Indiana Wesleyan U., M.S. 2005 (management)",,,1,1,1,Ind.,1,0,0,0,0,0,0,1,0,0,0,,,0,1,0,0,0,0,FALSE,1,FALSE,FALSE,FALSE,0,0,0,0,0,0,0,0,0,0,0,0,0,,
,"Gerald E. Connolly, D-Va.","Maryknoll College, B.A. 1971 (literature)
Harvard U., M.P.A. 1979",,,1,1,1,Va.,1,0,0,0,0,1,0,0,0,0,0,,,0,1,0,0,0,0,FALSE,1,FALSE,FALSE,FALSE,0,0,0,0,0,0,0,0,0,0,0,0,0,,
,"Warren Davidson, R-Ohio","U.S. Military Academy, B.S. 1995 (American history)
U. of Notre Dame, M.B.A. 2005",,,1,1,1,Ohio,1,1,0,0,1,0,0,0,0,0,0,,,0,1,0,0,0,0,FALSE,1,FALSE,FALSE,FALSE,0,0,0,0,0,0,0,0,0,0,0,0,0,,
,"Susan A. Davis, D-Calif.","U. of California, Berkeley, B.A. 1965 (sociology)
U. of North Carolina, M.A. 1968 (social work)",,,1,1,1,Calif.,1,0,0,0,0,0,1,0,0,0,0,,,0,1,0,0,0,0,FALSE,1,FALSE,FALSE,FALSE,0,0,0,0,0,0,0,0,0,0,0,0,0,,
,"Peter A. DeFazio, D-Ore.","Tufts U., B.A. 1969 (economics & political science)
U. of Oregon, attended 1969-71 (international studies)
U. of Oregon, M.S. 1977 (public administration & gerontology)",,,1,1,1,Ore.,1,0,0,0,0,0,0,1,0,0,0,,,0,1,0,0,0,0,FALSE,1,FALSE,FALSE,FALSE,0,0,0,0,0,0,0,0,0,0,0,0,0,,
,"Rosa DeLauro, D-Conn.","London School of Economics, attended 1962-63
Marymount College (N.Y.), B.A. 1964
Columbia U., M.A. 1966 (international politics)",,,1,1,1,Conn.,1,0,0,0,0,0,1,0,0,0,0,,,0,1,0,0,0,0,FALSE,1,FALSE,FALSE,FALSE,0,0,0,0,0,0,0,0,0,0,0,0,0,,
,"Suzan DelBene, D-Wash.","Reed College, B.A. 1983 (biology)
U. of Washington, M.B.A. 1990",,,1,1,1,Wash.,1,0,0,0,1,0,0,0,0,0,0,,,0,1,0,0,0,0,FALSE,1,FALSE,FALSE,FALSE,0,0,0,0,0,0,0,0,0,0,0,0,0,,
,"Bill Flores, R-Texas","Texas A&M U., B.B.A. 1976 (accounting)
Houston Baptist U., M.B.A. 1985",,,1,1,1,Texas,1,0,0,0,1,0,0,0,0,0,0,,,0,1,0,0,0,0,FALSE,1,FALSE,FALSE,FALSE,0,0,0,0,0,0,0,0,0,0,0,0,0,,
,"Jeff Fortenberry, R-Neb.","Louisiana State U., B.A. 1982 (economics)
Georgetown U., M.P.P. 1986
Franciscan U. of Steubenville, M.Div. 1996 (theology)",,,1,1,1,Neb.,1,0,0,0,0,1,0,0,0,1,0,,,0,1,1,0,0,0,FALSE,1,FALSE,FALSE,FALSE,0,0,0,0,0,0,0,0,0,0,0,0,0,,
,"Virginia Foxx, R-N.C.","Lees-McRae College, attended 1961
Appalachian State Teachers' College, attended 1962-63
U. of North Carolina, B.A. 1968 (English)
U. of North Carolina, M.A.C.T. 1972 (sociology)
U. of North Carolina, Greensboro, Ed.D. 1985 (curriculum and teaching/higher education)",,,1,1,1,N.C.,1,0,0,0,0,0,1,0,0,0,0,,,0,1,0,0,0,0,FALSE,1,FALSE,FALSE,FALSE,0,0,0,0,0,0,0,0,0,0,0,0,0,,
,"John Garamendi, D-Calif.","U. of California, Berkeley, B.S. 1966 (business administration)
Harvard U., M.B.A. 1970",,,1,1,1,Calif.,1,1,0,0,1,0,0,0,0,0,0,,,0,1,0,0,0,0,FALSE,1,FALSE,FALSE,FALSE,0,0,0,0,0,0,0,0,0,0,0,0,0,,
,"Andy Harris, R-Md.","U. of Pennsylvania, attended 1973-75
Johns Hopkins U., B.A. 1977 (human biology)
Johns Hopkins U., M.D. 1980
Johns Hopkins U., M.H.S. 1995 (health finance & management)",,,1,1,1,Md.,1,0,0,0,0,0,0,0,0,1,0,,,0,1,1,0,0,0,FALSE,1,FALSE,FALSE,FALSE,0,0,0,0,0,0,0,0,0,0,0,0,0,,
,"Jody B. Hice, R-Ga.","Asbury College, B.A. 1982 (Bible Theology)
Southwestern Baptist Theological Seminary, M.Div. 1986
Luther Rice U., D.Min. 1988",,,1,1,1,Ga.,1,0,0,0,0,0,0,0,0,1,0,,,0,1,1,0,0,0,FALSE,1,FALSE,FALSE,FALSE,0,0,0,0,0,0,0,0,0,0,0,0,0,,
,"Jim Langevin, D-R.I.","Rhode Island College, B.A. 1990 (political science & public administration)
Harvard U., M.P.A. 1994",,,1,1,1,R.I.,1,0,0,0,0,1,0,0,0,0,0,,,0,1,0,0,0,0,FALSE,1,FALSE,FALSE,FALSE,0,0,0,0,0,0,0,0,0,0,0,0,0,,
,"Rick Larsen, D-Wash.","Pacific Lutheran U., B.A. 1987 (political science)
U. of Minnesota, M.P.A. 1990",,,1,1,1,Wash.,1,0,0,0,0,1,0,0,0,0,0,,,0,1,0,0,0,0,FALSE,1,FALSE,FALSE,FALSE,0,0,0,0,0,0,0,0,0,0,0,0,0,,
,"Barbara Lee, D-Calif.","Mills College, B.A. 1973 (psychology)
U. of California, Berkeley, M.S.W. 1975",,,1,1,1,Calif.,1,0,0,0,0,0,0,1,0,0,0,,,0,1,0,0,0,0,FALSE,1,FALSE,FALSE,FALSE,0,0,0,0,0,0,0,0,0,0,0,0,0,,
,"Kevin McCarthy, R-Calif.","Bakersfield College, attended 1984-85
California State U., Bakersfield, B.S. 1989 (business administration)
California State U., Bakersfield, M.B.A. 1994",,,1,1,1,Calif.,1,1,0,0,1,0,0,0,0,0,0,,,0,1,0,0,0,0,FALSE,1,FALSE,FALSE,FALSE,0,0,0,0,0,0,0,0,0,0,0,0,0,,
,"Jim McGovern, D-Mass.","American U., B.A. 1981 (history)
American U., M.P.A. 1984",,,1,1,1,Mass.,1,0,0,0,0,1,0,0,0,0,0,,,0,1,0,0,0,0,FALSE,1,FALSE,FALSE,FALSE,0,0,0,0,0,0,0,0,0,0,0,0,0,,
,"Cathy McMorris Rodgers, R-Wash.","Pensacola Christian College, B.A. 1990 (pre-law)
U. of Washington, M.B.A. 2002",,,1,1,1,Wash.,1,0,0,0,1,0,0,0,0,0,0,,,0,1,0,0,0,0,FALSE,1,FALSE,FALSE,FALSE,0,0,0,0,0,0,0,0,0,0,0,0,0,,
,"John Moolenaar, R-Mich.","Hope College, B.A. 1983 (chemistry)
Harvard U., M.P.P. 1989",,,1,1,1,Mich.,1,0,0,0,0,1,0,0,0,0,0,,,0,1,0,0,0,0,FALSE,1,FALSE,FALSE,FALSE,0,0,0,0,0,0,0,0,0,0,0,0,0,,
,"Seth Moulton, D-Mass.","Harvard U., A.B. 2001 (physics)
Harvard U., M.P.P. 2011
Harvard U., M.B.A. 2011",,,1,1,1,Mass.,1,0,0,0,1,1,0,0,0,0,0,,,0,1,0,0,0,0,FALSE,1,FALSE,FALSE,FALSE,0,0,0,0,0,0,0,0,0,0,0,0,0,,
,"Richard E. Neal, D-Mass.","American International College, B.A. 1972 (political science)
U. of Hartford, M.P.A. 1976",,,1,1,1,Mass.,1,0,0,0,0,1,0,0,0,0,0,,,0,1,0,0,0,0,FALSE,1,FALSE,FALSE,FALSE,0,0,0,0,0,0,0,0,0,0,0,0,0,,
,"Steven M. Palazzo, R-Miss.","U. of Southern Mississippi, B.S.B.A. 1994 (accounting)
U. of Southern Mississippi, M.B.A. 1996",,,1,1,1,Miss.,1,1,0,0,1,0,0,0,0,0,0,,,0,1,0,0,0,0,FALSE,1,FALSE,FALSE,FALSE,0,0,0,0,0,0,0,0,0,0,0,0,0,,
,"Bill Pascrell Jr., D-N.J.","Fordham U., B.A. 1959 (journalism)
Fordham U., M.A. 1961 (philosophy)",,,1,1,1,N.J.,1,0,0,0,0,0,1,0,0,0,0,,,0,1,0,0,0,0,FALSE,1,FALSE,FALSE,FALSE,0,0,0,0,0,0,0,0,0,0,0,0,0,,
,"Bobby L. Rush, D-Ill.","Roosevelt U., B.A. 1973 (political science)
U. of Illinois, Chicago, attended 1975-77 (political science)
U. of Illinois, Chicago, M.A. 1994 (political science)
McCormick Theological Seminary, M.A. 1998 (theological studies)",,,1,1,1,Ill.,1,0,0,0,0,0,1,0,0,0,0,,,0,1,0,0,0,0,FALSE,1,FALSE,FALSE,FALSE,0,0,0,0,0,0,0,0,0,0,0,0,0,,
,"David Schweikert, R-Ariz.","Scottsdale Community College, A.A. 1985
Arizona State U., B.S. 1987 (real estate)
Arizona State U., M.B.A. 2005",,,1,1,1,Ariz.,1,1,0,0,1,0,0,0,0,0,0,,,0,1,0,0,0,0,FALSE,1,FALSE,FALSE,FALSE,0,0,0,0,0,0,0,0,0,0,0,0,0,,
,"David Scott, D-Ga.","Florida A&M U., B.A. 1967 (English & speech)
U. of Pennsylvania, M.B.A. 1969",,,1,1,1,Ga.,1,0,0,0,1,0,0,0,0,0,0,,,0,1,0,0,0,0,FALSE,1,FALSE,FALSE,FALSE,0,0,0,0,0,0,0,0,0,0,0,0,0,,
,"John Shimkus, R-Ill.","U.S. Military Academy, B.S. 1980
Southern Illinois U., Edwardsville, M.B.A. 1997",,,1,1,1,Ill.,1,1,0,0,1,0,0,0,0,0,0,,,0,1,0,0,0,0,FALSE,1,FALSE,FALSE,FALSE,0,0,0,0,0,0,0,0,0,0,0,0,0,,
,"Albio Sires, D-N.J.","Saint Peter's College, B.A. 1974 (Spanish & marketing)
Middlebury College, M.A. 1985 (Spanish)",,,1,1,1,N.J.,1,0,0,0,0,0,1,0,0,0,0,,,0,1,0,0,0,0,FALSE,1,FALSE,FALSE,FALSE,0,0,0,0,0,0,0,0,0,0,0,0,0,,
,"Steve Stivers, R-Ohio","Ohio State U., B.A. 1989 (international studies)
Ohio State U., M.B.A. 1996",,,1,1,1,Ohio,1,0,0,0,1,0,0,0,0,0,0,,,0,1,0,0,0,0,FALSE,1,FALSE,FALSE,FALSE,0,0,0,0,0,0,0,0,0,0,0,0,0,,
,"Bennie Thompson, D-Miss.","Tougaloo College, B.A. 1968 (political science)
Jackson State College, M.S. 1972 (educational administration)",,,1,1,1,Miss.,1,0,0,0,0,0,0,1,0,0,0,,,0,1,0,0,0,0,FALSE,1,FALSE,FALSE,FALSE,0,0,0,0,0,0,0,0,0,0,0,0,0,,
,"Mike Thompson, D-Calif.","California State U., Chico, B.A. 1982 (political science)
California State U., Chico, M.A. 1996 (public administration)",,,1,1,1,Calif.,1,0,0,0,0,0,1,0,0,0,0,,,0,1,0,0,0,0,FALSE,1,FALSE,FALSE,FALSE,0,0,0,0,0,0,0,0,0,0,0,0,0,,
,"Debbie Wasserman Schultz, D-Fla.","U. of Florida, B.A. 1988 (political science)
U. of Florida, M.A. 1990 (political science)",,,1,1,1,Fla.,1,0,0,0,0,0,1,0,0,0,0,,,0,1,0,0,0,0,FALSE,1,FALSE,FALSE,FALSE,0,0,0,0,0,0,0,0,0,0,0,0,0,,
3,"Kyrsten Sinema, D-Ariz.","Brigham Young U., B.S.W. 1995
Arizona State U., M.A. 1999 (social work)
Arizona State U., J.D. 2004
Arizona State U., Ph.D. 2012 (justice studies)",,,1,1,0,Ariz.,0,1,1,1,0,0,1,0,0,0,0,,,0,0,0,0,0,0,FALSE,FALSE,FALSE,1,FALSE,0,0,0,0,0,0,0,0,0,0,0,0,0,,
5,"Tim Murphy, R-Pa.","Wheeling Jesuit University, B.S.
Cleveland State University, M.A.
University of Pittsburgh, Ph.D. (psychology)",,,1,1,0,Pa.,0,1,0,1,0,0,1,0,0,0,0,,,0,0,0,0,0,0,FALSE,FALSE,FALSE,1,FALSE,0,0,0,0,0,0,0,0,0,0,0,0,0,,
1,"Dave Brat, R-Va.","Hope College, B.A. 1986 (business administration)
Princeton Theological Seminary, M.Div. 1990
American U., Ph.D. 1995 (economics)",,,1,1,0,Va.,1,0,0,1,0,0,0,0,0,1,0,,,0,0,0,0,0,0,FALSE,1,1,FALSE,FALSE,0,0,0,0,0,0,0,0,0,0,0,0,0,,
3,"Ileana Ros-Lehtinen, R-Fla.","Miami-Dade Community College, A.A. 1972 (English)
Florida International U., B.A. 1975 (English & education)
Florida International U., M.S. 1986 (education)
U. of Miami, Ph.D. 2004 (education)",,,1,1,0,Fla.,1,0,0,1,0,0,0,1,0,0,0,,,0,0,0,0,0,0,FALSE,1,1,FALSE,FALSE,0,0,0,0,0,0,0,0,0,0,0,0,0,,
4,"Joe L. Barton, R-Texas","Texas A&M U., B.S. 1972 (industrial engineering)
Purdue U., M.S. 1973 (industrial administration)",,,1,1,0,Texas,0,1,0,0,0,0,0,1,0,0,0,,,0,0,0,0,0,0,FALSE,FALSE,FALSE,1,FALSE,0,0,0,0,0,0,0,0,0,0,0,0,0,,
6,"Louise Slaughter, D-N.Y.","University of Kentucky, B.S., M.P.H.",,,1,1,0,N.Y.,0,1,0,0,0,0,0,0,1,0,0,,,0,0,0,0,0,0,FALSE,FALSE,FALSE,1,FALSE,0,0,0,0,0,0,0,0,0,0,0,0,0,,
3,"Martha McSally, R-Ariz.","U.S. Air Force Academy, B.S. 1988 (biology)
Harvard U., M.P.P. 1990",,,1,1,0,Ariz.,0,1,0,0,0,1,0,0,0,0,0,,,0,0,0,0,0,0,FALSE,FALSE,FALSE,1,FALSE,0,0,0,0,0,0,0,0,0,0,0,0,0,,
4,"Tim Walz, D-Minn.","Chadron State College, B.S. 1989 (social science education)
Minnesota State U., Mankato, M.S. 2001 (educational leadership)
Saint Mary's U. of Minnesota, attending",,,1,1,0,Minn.,0,1,0,0,0,0,0,1,0,0,0,,,0,0,0,0,0,0,FALSE,FALSE,FALSE,1,FALSE,0,0,0,0,0,0,0,0,0,0,0,0,0,,
1,"Leonard Lance, R-N.J.","Lehigh U., B.A. 1974 (American studies)
Vanderbilt U., J.D. 1977
Princeton U., M.P.A. 1982",,,1,1,0,N.J.,1,0,1,0,0,1,0,0,0,0,0,,,0,0,0,0,0,0,FALSE,1,1,FALSE,FALSE,0,0,0,0,0,0,0,0,0,0,0,0,0,,
3,"Sander M. Levin, D-Mich.","U. of Chicago, A.B. 1952
Columbia U., M.A. 1954 (international relations)
Harvard U., LL.B. 1957",,,1,1,0,Mich.,1,0,0,0,0,0,1,0,0,0,0,,,0,0,0,0,0,0,FALSE,1,1,FALSE,FALSE,0,0,0,0,0,0,0,0,0,0,0,0,0,,
4,"Tom Rooney, R-Fla.","Syracuse U., attended 1989
Washington & Jefferson College, B.A. 1993 (English literature)
U. of Florida, M.A. 1996 (political science)
U. of Miami, J.D. 1999",,,1,1,0,Fla.,1,0,1,0,0,0,1,0,0,0,0,,,0,0,0,0,0,0,FALSE,1,1,FALSE,FALSE,0,0,0,0,0,0,0,0,0,0,0,0,0,,
6,"Jim Bridenstine, R-Okla.","Rice University, B.A.
Cornell University, M.B.A.",,,1,1,0,Okla.,1,0,0,0,1,0,0,0,0,0,0,,,0,0,0,0,0,0,FALSE,1,1,FALSE,FALSE,0,0,0,0,0,0,0,0,0,0,0,0,0,,
5,"Bill Shuster, R-Pa.","Dickinson College, B.A. 1983 (political science & history)
American U., M.B.A. 1987",,,1,1,0,Pa.,1,0,0,0,1,0,0,0,0,0,0,,,0,0,0,0,0,0,FALSE,1,1,FALSE,FALSE,0,0,0,0,0,0,0,0,0,0,0,0,0,,
5,"Charlie Dent, R-Pa.","Pennsylvania State University, B.A.
Lehigh University, M.P.A.",,,1,1,0,Pa.,1,0,0,0,0,1,0,0,0,0,0,,,0,0,0,0,0,0,FALSE,1,1,FALSE,FALSE,0,0,0,0,0,0,0,0,0,0,0,0,0,,
